{
  "matrix_run_id": "unsloth-score-paper-n200",
  "created_at": "2026-10-18T04:06:43.765498+00:00",
  "dataset_path": "data/finagentbench",
  "sample_seed": 42,
  "sample_size": 200,
  "selected_example_ids": [
    "dev:chunk-only:q299865e6e67e",
    "dev:q9a5cfe35fecd",
    "dev:q9c255237096a",
    "dev:q8e053e02a010",
    "dev:q4acd5677c3da",
    "dev:qd08d64c0654c",
    "dev:q238a8429d152",
    "dev:qe2edf9d38872",
    "dev:chunk-only:q504aef305d62",
    "dev:q31f6fd1f392c",
    "dev:q4d8ac905167b",
    "dev:q95535bca90c9",
    "dev:q0d51e9ef12aa",
    "dev:q2fe5769567d7",
    "dev:qeccd6f3b9d06",
    "dev:q09b8cfa51b60",
    "dev:q27a01443f529",
    "dev:qff56bedc2f87",
    "dev:q8cc1033cf552",
    "dev:q811679c2d742",
    "dev:qd483c94f1ec6",
    "dev:q2d8eb319367a",
    "dev:qb35a5efa65ce",
    "eval:chunk-only:chunk_q29280e",
    "dev:chunk-only:qb7d1dfae8271",
    "eval:doc_qa9fda3",
    "dev:q3ef7ce37ae77",
    "dev:q05bfc5cb3e17",
    "dev:q99ec5f1aeea5",
    "dev:qb590e4e6d1ec",
    "dev:q1ab49a3f086f",
    "dev:q430300b97e2f",
    "dev:q7eb4e8a11956",
    "dev:q1ff3eed25e64",
    "eval:doc_q0617ad",
    "dev:qfbef9973c7fb",
    "dev:q0e5327ae1aff",
    "dev:qf8cbcec9fec6",
    "dev:q5d75c4f1ac86",
    "dev:q7b42f1295dc1",
    "dev:qf9c15fa46d48",
    "dev:q8b55a229e784",
    "dev:q0b8d55d58be2",
    "dev:q7c284aabbba4",
    "dev:qf5b4bbe60015",
    "dev:qa057a3d428a2",
    "dev:q636b07dd9c11",
    "dev:q4e3318b7d0e9",
    "dev:qf13afdfcadcf",
    "dev:qd5c685de4d7a",
    "eval:chunk-only:chunk_q9fad72",
    "dev:qdb9da6a1e373",
    "dev:q7ed5279a28b4",
    "dev:q5fca8aed3bbc",
    "dev:q645be3b7875e",
    "dev:q53994e82efbb",
    "dev:q70b3e2802bf7",
    "dev:q60107966eba4",
    "dev:chunk-only:qddfea8300793",
    "dev:chunk-only:qf59bea60dc8d",
    "dev:qa602975e3d19",
    "dev:q8e26f08be2bc",
    "dev:q044bb2c8810c",
    "eval:doc_q737b56",
    "dev:q7eb5b91e2366",
    "dev:qd639a486b106",
    "dev:chunk-only:q0fd4ca04c0a5",
    "dev:q1cfcd01ac3a1",
    "dev:qcdb8bc16cf2f",
    "dev:q88db5d96c8dd",
    "dev:q89953a08e494",
    "dev:q93fb2b2861c4",
    "dev:qc03648d89328",
    "dev:q79acb772ca6b",
    "dev:q140516364bb4",
    "dev:chunk-only:q40d417892141",
    "dev:qe8a08fb7bfff",
    "dev:qe1811f4fd3dc",
    "dev:qd422350b37cb",
    "dev:qbd63044fc6b3",
    "dev:qcbbca1138c08",
    "dev:chunk-only:qaf2d41946676",
    "dev:q1ded233d05aa",
    "eval:doc_q48ce69",
    "dev:chunk-only:q90faabe2b483",
    "dev:chunk-only:q7ca4de540868",
    "dev:q318eb902f451",
    "dev:chunk-only:qed0361d5a9ae",
    "dev:chunk-only:qeeb1c1a41ae3",
    "dev:q9dd3907388e3",
    "dev:q28b06421804c",
    "eval:chunk-only:chunk_q0b530d",
    "dev:qfd572ccfcb0f",
    "dev:q88819064dbb7",
    "dev:qe93fa46ab352",
    "dev:qc20017b12da3",
    "dev:q00e75b32eb34",
    "dev:chunk-only:q7b219decf5da",
    "dev:chunk-only:q2a401c1edf73",
    "dev:q587ea3fc913d",
    "dev:q24d0f908cfe3",
    "dev:chunk-only:q9ee9b517f484",
    "dev:qd177bdad4bdd",
    "dev:qb2123a701a82",
    "dev:qdbaa829dd4cc",
    "dev:q99a077efaab0",
    "dev:q86f79f57d973",
    "dev:q2c832749ca0b",
    "dev:qdfe52ef66df5",
    "dev:q7e2586950d8e",
    "dev:q56c2aa1b3aa2",
    "dev:q11ef281af9cd",
    "eval:chunk-only:chunk_q5ebb5e",
    "dev:q89fb186f5e49",
    "dev:qcf796a17c330",
    "dev:chunk-only:q5bb4a350edd8",
    "dev:q1f722f19a821",
    "dev:qdec70f55027f",
    "dev:chunk-only:q075970f6eb46",
    "dev:q0346b2bc5a8b",
    "dev:q95790ca7c1f5",
    "dev:q03a704904653",
    "dev:qd2e3bd55f2ee",
    "dev:qb26bf8457b0f",
    "dev:q5d883a6e3ff1",
    "dev:qc28e5aa0181b",
    "dev:q69d1505292c8",
    "dev:q719082ac2068",
    "dev:q64898e5ba36c",
    "dev:qf38450369367",
    "dev:q2aae5e2ea500",
    "dev:q29a452be41cd",
    "dev:qc8e6b0d72c52",
    "dev:q25119b32a2f9",
    "dev:q6cdb93e02e5f",
    "dev:qbdbd002b0a41",
    "dev:q3f9446fe3b94",
    "dev:q7ebef55d671d",
    "dev:qaf55b76bfcad",
    "dev:chunk-only:qb3a6bec7aedc",
    "dev:q57e9d5635f56",
    "dev:chunk-only:qf3b87e3d287f",
    "dev:qf25e1308bae4",
    "dev:q98c606bb3ce7",
    "dev:q536ce4006bf6",
    "dev:q84038a74fd59",
    "dev:qa5c748248a5b",
    "dev:qff73996028bf",
    "dev:q2451f8377cf4",
    "dev:qf7a3126727b8",
    "dev:qc187429e2dc5",
    "dev:q33197856c996",
    "dev:qb22cbf2f4782",
    "dev:chunk-only:qd7ede96b88aa",
    "eval:chunk-only:chunk_q8fc814",
    "dev:q9f32df79b0d7",
    "dev:chunk-only:q853c16a74704",
    "dev:q909c4baef1ee",
    "dev:qe99b7fb80e2c",
    "dev:chunk-only:qa431f3f55a5e",
    "dev:qc4efe3f0f342",
    "dev:qb500a9b42ef8",
    "dev:q41a18ce876e2",
    "dev:q2173e7c263c1",
    "dev:q01b84969979c",
    "dev:qf8e3e71e08c9",
    "dev:q63259a02ade0",
    "eval:chunk-only:chunk_q44d295",
    "eval:chunk-only:chunk_q2ccba5",
    "dev:q78d98dc75a82",
    "dev:q70e4aac30ddb",
    "dev:q1463bdfd6910",
    "dev:q29d3cb8df822",
    "dev:qfa38830206fb",
    "dev:chunk-only:q3a71644741b7",
    "dev:qba0102803c57",
    "dev:chunk-only:q7ff47a7d2a20",
    "dev:chunk-only:qbcda53de470c",
    "dev:qc20e5c5b254e",
    "dev:qb00e9c27fd32",
    "dev:q359aee1441c1",
    "dev:qa9744c8552ed",
    "dev:q44cfaf358c37",
    "dev:q4f1cc6ea4ba6",
    "dev:q76caada13eca",
    "dev:q0faf9d780cdc",
    "dev:q6d2cc453ca8c",
    "dev:q9597b3e4d1b2",
    "dev:qc6c8c1f4ddfe",
    "dev:q6c95b5e5930d",
    "dev:qd87c2da5e7da",
    "dev:q5ce8ea5bf1b9",
    "dev:q8ba6a388d681",
    "dev:qa33b36ffd2c1",
    "dev:q2ec971ec73f9",
    "dev:q4bf1699a63fe",
    "eval:chunk-only:chunk_q829eae",
    "dev:qab00fabe02dc",
    "dev:q79ae686681b7",
    "dev:qba50bc033945"
  ],
  "partners": {
    "stage1_partner_id": "anyjev-l0",
    "stage2_partner_id": "clm-8b",
    "block_a_stage2": "decision20-lux",
    "block_b_stage1": "decision20-lux",
    "binding": "architecture-pairs"
  },
  "gemini_model": "gemini-2.5-flash",
  "systemone_mock": false,
  "synthesis_enabled": false,
  "rows": [
    {
      "variable_config_id": "lux-unsloth-score",
      "eval_run_id": "unsloth-score-paper-n200:lux-unsloth-score",
      "stage1_engine_id": "frozen-lux-choice",
      "stage2_engine_id": "bm25-unsloth-score-shortlist-32",
      "status": "completed",
      "error": null,
      "metrics": {
        "n_examples": 200,
        "stage1_ndcg_at_5": 0.8478091588876772,
        "stage1_map_at_5": 0.9047205180640763,
        "stage1_mrr_at_5": 0.9644171779141104,
        "stage2_ndcg_at_5": 0.605914883400855,
        "stage2_map_at_5": 0.6131410256410256,
        "stage2_mrr_at_5": 0.7944444444444445,
        "stage2_ndcg_at_5_given_top1": 0.6426075307401754,
        "stage2_map_at_5_given_top1": 0.6447554347826088,
        "stage2_mrr_at_5_given_top1": 0.7875,
        "stage2_ndcg_at_5_pipeline": 0.3544602067895001,
        "stage2_mrr_at_5_pipeline": 0.46475,
        "pipeline_yield": 0.585,
        "n_scored": 117,
        "stage1_top1_recall": 0.9325153374233128,
        "stage1_top5_recall": 1.0,
        "empty_top1_chunk_rate": 0.375,
        "option_flip_rate": null,
        "parse_failure_rate": 0.0,
        "latency_ms_p50": 0.007160500103964296,
        "latency_ms_p95": 0.01397190308125572,
        "latency_stage1_p50_ms": 0.007160500103964296,
        "latency_stage1_p95_ms": 0.01397190308125572,
        "latency_stage2_p50_ms": 28631.307545000025,
        "latency_stage2_p95_ms": 39734.9663307999,
        "gpu_mem_high_water_mb": 23174.66748046875,
        "answer_normalized_em": null,
        "answer_token_f1": null,
        "n_synthesis_attempted": 0,
        "n_synthesis_failed": 0,
        "n_empty_top1": 75,
        "blocks": [],
        "stage1_unsupported_reason": null,
        "stage2_unsupported_reason": null
      },
      "blocks": [],
      "collapsed_stages": false,
      "role": "trained_decision"
    }
  ]
}